<?xml version="1.0" encoding="UTF-8"?>
<!DOCTYPE component SYSTEM "http://www.bonkenc.org/boca/component.dtd">
<component>
  <name>OptimFROG Audio Encoder</name>
  <version>1.0</version>
  <id>ofr-out</id>
  <type>encoder</type>
  <format>
    <name>OptimFROG Files</name>
    <extension>ofr</extension>
    <tag mode="append">APEv2</tag>
  </format>
  <external>
    <command>codecs/cmdline/ofr.exe</command>
    <arguments>--encode %OPTIONS %INFILE --output %OUTFILE</arguments>
    <mode>file</mode>
    <informat>wave</informat>
    <parameters>
      <selection name="Encoding mode" argument="--mode %VALUE" default="normal">
	<option alias="Fast">fast</option>
	<option alias="Normal">normal</option>
	<option alias="High">high</option>
	<option alias="Extra">extra</option>
	<option alias="Best">best</option>
	<option alias="High, new">highnew</option>
	<option alias="Extra, new">extranew</option>
	<option alias="Best, new">bestnew</option>
      </selection>
      <switch name="Store MD5 of original PCM data" argument="--md5" enabled="true"/>
      <switch name="Add recovery information to files" argument="--recovery"/>
      <selection name="Seeking" argument="--seek %VALUE" default="normal">
	<option alias="Fast">fast</option>
	<option alias="Normal">normal</option>
	<option alias="Slow">slow</option>
	<option alias="Minimum">min</option>
      </selection>
      <selection name="Optimization" argument="--optimize %VALUE" default="fast">
	<option alias="Disabled">none</option>
	<option alias="Fast">fast</option>
	<option alias="Normal">normal</option>
	<option alias="High">high</option>
	<option alias="Best">best</option>
      </selection>
    </parameters>
  </external>
</component>
