<?xml version="1.0" encoding="UTF-8"?>
<!DOCTYPE component SYSTEM "http://www.freac.org/boca/component.dtd">
<component>
  <name>Aften A/52 (AC3) Encoder</name>
  <version>1.0</version>
  <id>aften-out</id>
  <type>encoder</type>
  <format>
    <name>AC3 Files</name>
    <extension>ac3</extension>
  </format>
  <external>
    <command>codecs/cmdline/aften.exe</command>
    <arguments>%OPTIONS %INFILE %OUTFILE</arguments>
    <mode>file</mode>
    <informat>wave</informat>
  </external>
</component>
